,Name,Year,Rating,Critic Consensus,Summary
0,Invincible: Season 2,(2023),100,"Still as bracing as a punch to the face and invigorating with its vivid worldbuilding, Invincible is practically impervious to disappointing audiences in this sterling sophomore season.",
1,Reservation Dogs: Season 3,(2023),100,"Bowing out while still having plenty of creativity to spare, Reservation Dogs' final season sidesteps feeling premature by satisfying on every level.",
2,Reacher: Season 2,(2023),98,"Brawny as Alan Ritchson's biceps, Reacher swaggers confidently into its sophomore season as rock 'em sock 'em pulp with a sly wink.",
3,Happy Valley: Season 3,(2023),100,"Full of highs and with nary a low, Happy Valley returns at the peak of its hardscrabble powers, with Sarah Lancashire seamlessly slipping back into her quintessential role for one final mystery.",
4,A Small Light: Limited Series,(2023),100,"Bel Powley's arresting performance burns bright in A Small Light, a sensitive portrait of heroism in the face of all-encompassing tragedy.",
5,Colin from Accounts: Season 1,(2022),100,"Tonally elastic and blessed with Patrick Brammall and Harriet Dyer's sparky chemistry, Colin from Accounts makes the alchemy of a satisfying rom-com feel effortless.",
6,Foundation: Season 2,(2023),100,"With its complicated bedrock now established, Foundation spreads its wings in an improved sophomore season that rewards viewers' patience with a brainy sci-fi epic of genuine grandeur.",
7,Drops of God: Season 1,(2023),100,"A saga of cutthroat competition with notes of cool intelligence, Drops of God is a sleek entertainment sure to stimulate refined palates.",
8,Cunk on Earth: Season 1,(2022),100,"Diane Morgan feigns dopiness with ingenious comedic timing in Cunk on Earth, a gut-busting sendup of anthropological documentaries.",
9,The Other Two: Season 3,(2023),100,"The elder Dubek siblings may still feel like they're also-rans, but The Other Two remains cream of the crop in a third season that turns foiled dreams into delightful comedy.",
10,Primo: Season 1,(2023),100,"Bearing the unmistakable stamp of creator Shea Serrano's authentic voice, Primo is a generation-spanning sitcom that feels like home.",
11,Deadloch: Season 1,(2023),100,"An irreverent twist on the crime procedural, Deadloch's addictive mixture of mystery and mordant humor makes most of its corpse-strewn competition look comparably stiff.",
12,For All Mankind: Season 4,(2023),100,"Houston, there's no problem here -- For All Mankind's fourth season hones in on what the series does best and forges ahead with a thought-provoking revisionist history.",
13,Blue Eye Samurai: Season 1,(2023),100,"Visually dazzling while paying deft attention to character, Blue Eye Samurai is a masterfully rendered animated adventure.",
14,Scavengers Reign: Season 1,(2023),100,"Disturbing and wondrous, Scavengers Reign presents a vividly realized world that beckons exploration by its marooned characters and television viewers alike.",
15,Somebody Somewhere: Season 2,(2023),100,"Somebody Somewhere captures the bittersweet beauty of life in all its minutiae, never forgetting to laugh in the face of adversity.",
16,Gremlins: Secrets of the Mogwai: Season 1,(2023),100,"Recapturing the original movies' blend of cuteness and mayhem, Secrets of the Mogwai is delightful family entertainment -- just don't feed it after midnight.",
17,Killing It: Season 2,(2023),100,"Scathing as ever and even funnier than before, Killing It's sophomore season compresses capitalistic malaise into a comedic diamond.",
18,The Bear: Season 2,(2023),99,"Instead of reinventing the menu, The Bear's second season wisely opts to toss its lovable characters into another frying pan of adversity, lets 'em cook, and serves up yet another supremely satisfying dish.",
19,Star Trek: Strange New Worlds: Season 1,(2022),99,"Strange New Worlds treks across familiar territory to refreshing effect, its episodic structure and soulful cast recapturing the sense of boundless discovery that defined the franchise's roots.",
20,Beef: Season 1,(2023),98,"Ali Wong and Steven Yeun are a diabolically watchable pair of adversaries in Beef, a prime cut comedy that finds the pathos in pettiness.",
21,Poker Face: Season 1,(2023),98,"With the incomparable Natasha Lyonne as an ace up its sleeve, Poker Face is a puzzle box of modest ambitions working with a full deck.",
22,Star Trek: Picard: Season 3,(2023),98,"Finally getting the band back together, Picard's final season boldly goes where the previous generation had gone before -- and is all the better for it.",
23,Gen V: Season 1,(2023),97,"Just about as gruesomely subversive as its origin series, Gen V builds on The Boys in occasionally chaotic but overall inspired fashion.",
24,Succession: Season 4,(2023),97,"As compulsively watchable as ever, Succession's final season concludes the saga of the backbiting Roy family on a typically brilliant -- and colorfully profane -- high note.",
25,Star Trek: Strange New Worlds: Season 2,(2023),97,"Boldly going where this hallowed franchise has gone before with effervescent execution, Strange New Worlds' superb sophomore season continues to recapture classic Trek with modern verve.",
26,Schmigadoon!: Season 2,(2023),97,"Schmigadoon! returns with more libido, pizzazz, and all that jazz in a sophomore season that improves upon what was already a nifty production.",
27,The Last of Us: Season 1,(2023),96,"Retaining the most addictive aspects of its beloved source material while digging deeper into the story, The Last of Us is bingeworthy TV that ranks among the all-time greatest video game adaptations.",
28,Only Murders in the Building: Season 3,(2023),96,"Relocating the action to the theatre, Only Murders in the Building can take a bow for yet another twisty mystery handled with a good-humored touch.",
29,I'm a Virgo: Season 1,(2023),96,"Boots Riley's towering imagination looms as large as his supersized hero in I'm a Virgo, an uproarious satire that's given an enormous heart to match by star Jharrel Jerome.",
30,Barry: Season 4,(2023),96,"What began as a macabre comedy is now close to completely shorn of genuine mirth, but Bill Hader's masterful indictment of stardom closes the curtain with one hell of an encore.",
31,Percy Jackson and the Olympians: Season 1,(2023),92,"A faithful adaptation of Rick Riordan's novels, Percy Jackson and the Olympians is a lovingly realized odyssey through adolescence and myth.",
32,Heartstopper: Season 2,(2023),96,"Beautifully acted and scripted, Heartstopper's second season is fit to bursting with emotional truth.",
33,Scott Pilgrim Takes Off: Season 1,(2023),96,"Retaining the heart and wit of the original movie while also carving out a fresh path for itself, Scott Pilgrim takes off in the animated medium and soars.",
34,Fargo: Season 5,(2023),92,"A back-to-basics caper populated by the likes of a mesmerizing Juno Temple and a thick slice of Hamm, Fargo's fifth season is a superb return to peak form.",
35,The Marvelous Mrs. Maisel: Season 5,(2023),96,"All good comedy sets must arrive at a final punchline, and The Marvelous Mrs. Maisel reliably nails its own with a fifth season that wisely puts Rachel Brosnahan and Alex Borstein's repartee front and center.",
36,Our Flag Means Death: Season 2,(2023),96,"Our Flag Means Death's sophomore season doubles down on the fans' favorite ship to some diminishing returns, but it still delivers enough joyous moments to get viewers' sabers rattling.",
37,Telemarketers: Season 1,(2023),96,Hold the phone! A truly stranger than fiction scandal is recounted with addictive aplomb in this gritty and farcical docuseries.,
38,I Think You Should Leave With Tim Robinson: Season 3,(2023),96,"Now that I Think You Should Leave's rhythms have become a recognizable pattern, some of these sketches CAN'T hit, but most of them still CAN hit -- and indeed they do, with quotable hilarity.",
39,Harley Quinn: Season 4,(2023),96,"Having settled into one of DC's most dependably entertaining series, Harley Quinn continues to be funny, quirky, and romantic.",
40,Queen Charlotte: A Bridgerton Story: Season 1,(2023),95,"A resplendent romance between two of the most interesting characters in the Bridgerton saga, Queen Charlotte is a spin-off that arguably perfects the primary series' formula.",
41,Slow Horses: Season 1,(2022),95,"Slow Horses refreshes the espionage genre by letting its band of snoops be bumbling, with Gary Oldman giving a masterclass in frumpy authority.",
42,Party Down: Season 3,(2023),95,"Returning after a long layoff, Party Down brings patient fans a third season that's every bit as sharp -- and laugh-out-loud funny -- as its predecessors.",
43,The Afterparty: Season 2,(2023),95,"The Afterparty welcomes in a mostly new cast and keeps things festive with its enduringly clever Rashomon-style format, stirring up an entertainment that viewers won't want to end.",
44,What We Do in the Shadows: Season 5,(2023),95,"Displaying a comedic longevity that'd make even a vampire blush, What We Do in the Shadows enters its fifth season showing no signs of getting long in the fang.",
45,Best Interests: Season 1,(2023),95,"Sharon Horgan and Michael Sheen turn in some of their best work yet in Best Intentions, a frank depiction of any parent's worst nightmare that is equal parts graceful and harrowing.",
46,Starstruck: Season 3,(2023),95,"Shining bright and casting a warm glow over viewers, Starstruck continues to be masterful comfort television in this sweet third season.",
47,The Traitors: Season 1,(2023),95,"Hosted by Alan Cumming with theatrical relish, The Traitors deploys a rogues' gallery of reality television stars to make for a compelling murder mystery party.",
48,Transatlantic: Season 1,(2023),95,"Ably dramatizing a deadly serious chapter of World War II history while also remembering to have fun, Transatlantic is a visually sumptuous throwback to classic Hollywood melodramas.",
49,Stonehouse: Season 1,(2023),95,Stonehouse reenacts one of Britain's most ridiculous spy games with wry flair while star Matthew Macfadyen puts on a masterclass of fecklessness.,
50,Yellowjackets: Season 2,(2023),93,"Having already made a startling first impression, Yellowjackets coils itself in a second season preparing for the long haul -- thankfully, its superb performances and mesmeric ambience are fine substitutes for fast answers.",
51,The Curse: Season 1,(2023),94,"A wickedly uncomfortable marriage of sensibilities between Nathan Fielder and Benny Safdie, with a masterful Emma Stone tying everything together, The Curse will make viewers cackle and squirm in equal measure.",
52,American Born Chinese: Season 1,(2023),94,"Jam-packed with inventive flourishes and grounded by lovable actors, American Born Chinese musters epic elements from Chinese mythology to tell a deeply relatable coming of age story.",
53,Platonic: Season 1,(2023),93,"Even with bold swings and romance off the table, the rambunctious rapport between Rose Byrne and Seth Rogen makes Platonic an ideal relationship comedy.",
54,Lucky Hank: Season 1,(2023),93,"With the fortune of Bob Odenkirk in its favor, Lucky Hank makes ennui essential viewing with a comedy rooted in relatable human behavior.",
55,Rain Dogs: Season 1,(2023),93,"Authentically brutal with pinpricks of humor that's all the more true to life, Rain Dogs is a bracing story of toil that proves to be immensely rewarding.",
56,The Gilded Age: Season 2,(2023),94,"More topical than before while also owning its frivolous appeal with unapologetic splendor, Julian Fellowes' operatic soap enters its own halcyon age.",
57,You: Season 4,(2023),92,"The hunter becomes prey in You's London-set fourth season, which shows some wear as this premise begins to outlive its believability -- but Penn Badgley's sardonic performance continues to paper over most lapses in logic.",
58,Mrs. Davis: Season 1,(2023),92,"Positively bonkers while undergirded by an intelligent design, Mrs. Davis makes Betty Gilpin a hero for modern times in a highly imaginative mixture of spirituality and technology.",
59,The Big Door Prize: Season 1,(2023),92,"Turning a high concept into a grounded good time, The Big Door Prize realizes its full potential thanks to a lovable cast of relatable characters.",
60,The Gold: Season 1,(2023),92,"A glittering cast is worth its weight in Gold, giving this posh caper plenty of compelling glamor to go along with its trenchant class commentary.",
61,Shrinking: Season 1,(2023),91,"Shrinking has darker ideas on its mind than its earnest approach can often translate, but Jason Segel and Harrison Ford's sparkling turns make these characters worth close analysis.",
62,Justified: City Primeval: Season 1,(2023),91,"Timothy Olyphant's quickdraw charm shows no signs of dulling in City Primeval, an introspective and very welcome return for Raylan Givens.",
63,Sex Education: Season 4,(2023),91,"As sweetly empathetic and inclusive as ever, Sex Education's final season serves as a bittersweet -- but largely satisfying -- farewell.",
64,Beckham: Limited Series,(2023),88,"Blessed with an affable and charismatic subject, Beckham's intimate access to one of the world's most renowned athletes makes for a delightful binge.",
65,Welcome to Wrexham: Season 2,(2023),91,"While its marquee stars are plenty welcoming all their own, Wrexham smartly spends its sophomore season focused on the community itself to inspiring effect.",
66,The Fall of the House of Usher: Limited Series,(2023),90,"Presenting vintage Poe stories filtered through Mike Flanagan's deliciously dark lens, The Fall of the House of Usher will get a rise out of horror fans.",
67,Fellow Travelers: Limited Series,(2023),91,"A queer romance with the full breadth and depth of an epic, Fellow Travelers is a moving showcase for Matt Bomer and Jonathan Bailey's captivating on-screen chemistry.",
68,The Clearing: Season 1,(2023),90,"Deriving extra flavor from its Australian setting and Miranda Otto's unsettling performance, The Clearing is an eerie thriller with plenty to recommend.",
69,Everyone Else Burns: Season 1,(2023),90,"A mirthful satire of religious zealotry that hits more than it misses, Everyone Else Burns is an agreeably irreverent sitcom.",
70,Minx: Season 2,(2023),89,"Still getting great mileage from its marriage of the feminist and the frivolous, Minx's second season is smart, sexy, and fun.",
71,Hijack: Season 1,(2023),88,"Largely devoid of storytelling turbulence and benefitting greatly from its real-time pacing, Hijack is a glossy but effective thriller that achieves genuine liftoff.",
72,Silo: Season 1,(2023),88,"With deft writing, awe-inspiring production design and the inestimable star power of Rebecca Ferguson, Silo is a mystery box well worth opening.",
73,A Murder at the End of the World: Limited Series,(2023),88,"founding as it is seductive, Murder at the End of the World is a worthy brain-teaser for fans of Brit Marling and Zal Batmanglij's offbeat storytelling.",
74,Pretty Baby: Brooke Shields: Season 1,(2023),88,"As much an exposé on ugly cultural forces as it is a straightforward presentation of Brooke Shields' life, Pretty Baby is disturbing and triumphant in equal measure.",
75,Harlan Coben's Shelter: Season 1,(2023),88,"arrying off a mature mystery with a light touch, Shelter is an absorbing and spry adaptation of Harlan Coben's work.",
76,A Spy Among Friends: Limited Series,(2022),88,"More cerebral than outright thrilling, A Spy Among Friends is an intelligent tale of espionage elevated by a pair of sterling performances.",
77,Swarm: Season 1,(2023),87,"Swarm can be as unpleasant as a hornet sting, but Dominique Fishback's ferocious performance and the creators' bold creative swings add up to a truly subversive take on toxic fandom.",
78,Good Omens: Season 2,(2023),87,"Boding well for the series' longevity, Good Omens' second season is even more splendid than the first.",
79,Star Wars: Ahsoka: Season 1,(2023),86,"Elevated by Rosario Dawson's strong performance in the title role and a solid story that balances new and old elements of the Star Wars saga, Ahsoka is a must-watch for fans of the franchise.",
80,Futurama: Season 11,(2023),86,Shut up and take our money!,
81,The Muppets Mayhem: Season 1,(2023),86,"The Muppets Mayhem might be too slight to find the Rainbow Connection, but its ragtag band of plucky puppets and plethora of showbiz gags make for a solid addition to the franchise.",
82,The Wheel of Time: Season 2,(2023),86,The Wheel of Time keeps spinning on a steady track in a rousing second season that deepens its characters.,
83,Dead Ringers: Limited Series,(2023),85,"If Dead Ringers doesn't wield as cutting a blade as David Cronenberg's original chiller, it's not a pale imitation either, thanks to Rachel Weisz putting on a clinic in doppelgänger duplicity.",
84,One Piece: Season 1,(2023),85,One Piece captures the essence of its beloved source material with a charmingly big-hearted adaptation that should entertain longtime fans as well as patient newcomers.,
85,The Mandalorian: Season 3,(2023),85,"Mileage may vary by a couple parsecs as The Mandalorian becomes more and more about the connective tissue of broader Star Wars lore, but this remains one of the most engaging adventures in a galaxy far, far away.",
86,The Other Black Girl: Season 1,(2023),85,"A clever spin on the pressures of office culture, The Other Black Girl blends comedy and horror to thrilling effect.",
87,Tiny Beautiful Things: Limited Series,(2023),85,"Tiny Beautiful Things is littered with cumbersome narrative choices, but Kathryn Hahn's soulful performance is one big plus that keeps this adaptation firmly compelling.",
88,The Company You Keep: Season 1,(2023),85,"The Company You Keep gets off to a rocky start in the first few episodes, but the show's appealing cast and entertaining blend of crime and romance will pay off for patient viewers.",
89,Survival of the Thickest: Season 1,(2023),85,"A genial showcase for Michelle Buteau, Survival of the Thickest is equal parts amusing and heartwarming.",
90,Monarch: Legacy of Monsters: Season 1,(2023),89,"With performances by father-son duo Kurt and Wyatt Russell that work a charm, Monarch adds a welcome wrinkle to the Godzilla legacy by honing its monstrous scope to a very human level.",
91,Lessons in Chemistry: Season 1,(2023),86,"Touching on several hot button issues while benefitting immensely from a perfect pinch of Brie Larson, Lessons in Chemistry's ambitious ingredients add up to satisfying entertainment.",
92,Perry Mason: Season 2,(2023),84,"More cohesive and engaging than its woolly first installment, Perry Mason's sophomore season is a marked improvement driven by an urgent sense of purpose, with Matthew Rhys commandingly watchable as ever.",
93,The Diplomat: Season 1,(2023),83,"Keri Russell's scrappy performance negotiates the best possible terms for The Diplomat, a soapy take on statecraft that manages to make geopolitical crises highly bingeable entertainment.",
94,Ted Lasso: Season 3,(2023),81,"Ted Lasso's third and possibly final season takes time to find its footing, but patient viewers who believe will find that they appreciate Coach as much as ever.",
95,Loki: Season 2,(2023),82,"Loki's dizzying, dazzling second season may rely on sleight of hand to distract from its slightly less satisfying storyline, but the end result still contains enough of that old Marvel magic to entertain.",
96,The Lost Flowers of Alice Hart: Season 1,(2023),82,"Sigourney Weaver is excellent as a thorny matriarch in The Lost Flowers of Alice Hart, a visually appealing and well-acted melodrama.",
97,Jury Duty: Season 1,(2023),83,While this courtroom comedy isn't as tedious as actual jury duty -- largely thanks to a very game James Marsden -- the verdict is still out on whether its stylistic gambit pays off.,
98,Winning Time: The Rise of the Lakers Dynasty: Season 2,(2023),82,"Trying to defend the title is hard, but Winning Time's sophomore season keeps pace as some of the best courtside seats to sports history that television can provide.",
99,Strange Planet: Season 1,(2023),82,"Leveraging its alien conceit to make astute observations about society, Strange Planet is wryly amusing and relatably human.",
100,"XO, Kitty: Season 1",(2023),81,"A modest and sweet extension of all the films that fans have loved before, XO, Kitty aims straight for the heart and finds its mark.",
101,Bodies: Limited Series,(2023),81,"Anchored by the indispensable Stephen Graham, Bodies' multiple twisting time strands coalesce into one satisfying binge.",
102,Break Point: Season 1,(2023),81,"Serving up a fresh look at the next generation of tennis stars, Break Point is strictly for established fans of tennis but full of well-aimed volleys into insight.",
103,The Super Models: Season 1,(2023),83,"Glossy as a magazine cover, The Super Models largely sidesteps the thornier aspects of the fashion world but centers some of its most iconic stars on their own terms.",
104,Full Circle: Limited Series,(2023),78,"Full Circle's windy plotting may prove too labyrinthine for casual enjoyment, but Steven Soderbergh's assured direction and a stacked cast give this simmering noir plenty of intrigue.",
105,The Horror of Dolores Roach: Season 1,(2023),80,"The Horror of Dolores Roach bites off more than it could chew with the delicate balance between horror and humor, but Justina Machado's commitment to the zany premise makes for a savory snack of a series.",
106,Shadow and Bone: Season 2,(2023),80,"Shadow and Bone's sophomore season packs in too much story sinew to properly breathe, but this adventure remains great fun for fantasy fans.",
107,Culprits: Season 1,(2023),83,"lprits is a stylish caper packed with enough twists to solve a Rubik's Cube, making for a bloody entertaining binge.",
108,The Witcher: Season 3,(2023),79,"apably shouldered by Henry Cavill's gruff charm, The Witcher's plotty third season pays a fittingly fond farewell to this particular Geralt of Rivia.",
109,The Consultant: Season 1,(2023),79,"With Christoph Waltz's menacing charm on retainer, The Consultant compensates for its lack of depth with slick presentation and diverting twists.",
110,Lawmen: Bass Reeves: Season 1,(2023),81,"With David Oyelowo capably stepping into the stirrups of Bass Reeves, this gritty procedural is slow to the draw but hits its mark nonetheless.",
111,Bupkis: Season 1,(2023),78,"Pete Davidson's second crack at playing a fictionalized version of himself may feel faintly recycled, but a terrific supporting cast and some surprising depth ensure this series adds up to more than just Bupkis.",
112,The Buccaneers: Season 1,(2023),76,"Anachronistic to the max and loving it, The Buccaneers is a feminist and frothy treat for fans of period piece pageantry.",
113,Based on a True Story: Season 1,(2023),76,"True crime enthusiasts have been satirized more sharply, but engaging leads and a lightly humorous touch make Based on a True Story worth investigating.",
114,Rabbit Hole: Season 1,(2023),76,"Although Rabbit Hole tumbles into one twist too many, Kiefer Sutherland remains compelling in his welcome return to the espionage genre.",
115,That '90s Show: Season 1,(2023),75,"A solidly serviceable sequel series, That '90s Show may take a little time to find its rhythm, but still delivers a respectable number of warmly nostalgic laughs.",
116,Goosebumps: Season 1,(2023),74,"Wickedly inventive enough to give viewers the creeps if not nightmares, Goosebumps solidly transplants R.L. Stine's spooky stories into a serialized format.",
117,The Night Agent: Season 1,(2023),74,"Bingeable as a beach read and just as forgettable, The Night Agent is a routine spy thriller told with commendable bravado.",
118,The Walking Dead: Daryl Dixon: Season 1,(2023),71,"g Norman Reedus' fan favorite character in a fresh setting, Daryl Dixon can be a wobbly shot across the crossbow but still gives The Walking Dead faithful plenty more to chew on.",
119,Hunters: Season 2,(2023),71,"While it never realizes its full potential as a revenge fantasy for real historical atrocity, Hunters tracks down a satisfying enough conclusion in this second and final season.",
